{
  "world_size": [
    8.0,
    8.0
  ],
  "start": [
    0.5,
    0.5
  ],
  "goal": [
    7.5,
    7.5
  ],
  "goal_yaw": null,
  "forbidden_regions": [],
  "soft_avoid_regions": [],
  "clearance": 0.0,
  "speed": "normal",
  "preference": "default",
  "interpretation_notes": "오른쪽 위 구석을 [7.5,7.5]로 해석"
}