{
  "world_size": [
    8.0,
    8.0
  ],
  "start": [
    0.5,
    0.5
  ],
  "goal": [
    6.0,
    6.0
  ],
  "goal_yaw": null,
  "forbidden_regions": [],
  "soft_avoid_regions": [
    {
      "type": "circle",
      "center": [
        3.0,
        3.0
      ],
      "radius": 1.5
    }
  ],
  "clearance": 0.0,
  "speed": "normal",
  "preference": "safe",
  "interpretation_notes": "(6,6)까지 안전하게, (3,3) 근처(반경1.5)는 위험해서 soft 회피"
}