{
  "world_size": [8.0, 8.0],
  "start": [0.5, 0.5],
  "goal": [7.5, 7.5],
  "goal_yaw": null,
  "forbidden_regions": [{"type": "box", "min": [3.0, 3.0], "max": [5.0, 5.0]}],
  "soft_avoid_regions": [],
  "clearance": 0.3,
  "speed": "slow",
  "preference": "default",
  "interpretation_notes": "오른쪽 위 구석으로 가되 중앙 [3,3]~[5,5] 박스는 절대 회피, 천천히"
}
